{
  "receipt_version": "1",
  "receipt_id": "sha256:aef6e1fcaad6e8d7ead0071ccaa2948f822c5608d43f27835d32d1fc557bf8aa",
  "subject": {
    "operation": "resolve",
    "protocol_release": {
      "id": "0.3.1",
      "digest": "sha256:fcda7142fb490c8c8321b0573f6304d06a452dc00539ed54e4506cc0ec8a8685"
    },
    "packages": {
      "root": {
        "id": "org.seedspec.fixtures.comprehensive-application",
        "version": "0.1.0",
        "digest": "sha256:87cbb879960dfca371620a19bb0c7c0b0931f73060d0671ba8e634aeca0204a9"
      },
      "additions": [
        {
          "id": "org.seedspec.fixtures.portable-feature",
          "version": "0.1.0",
          "digest": "sha256:8fdfe9e9b29fefd53deff2962e54d2d26a3fa05ce1e3054d70dbd86df02f7789"
        }
      ]
    },
    "inputs": {
      "configuration_selections": "sha256:b196f7c8f60cffdf2cf4b945224cb015e17c7ef31e016e2e508887c341df7cdf",
      "applied_intent": "sha256:5c2f59c1670756a1c95d15cfb2ba962f2a3b6802aeb924350c70a63513fcd390"
    },
    "result": {
      "status": "ready",
      "output_digest": "sha256:f97fe22a864d6ea155b366256a81a53b802a9889f53fe3519cd6c4f09121bf01"
    }
  },
  "producer": {
    "name": "@seedspec/runtime",
    "version": "0.3.1"
  }
}
