{
  "receipt_version": "1",
  "receipt_id": "sha256:726d5f4fee84d5f8ea9bf41b50237849af73352b440de8392383d7959d4697ce",
  "subject": {
    "operation": "resolve",
    "protocol_release": {
      "id": "0.2.1",
      "digest": "sha256:1fb3d4c93d8a652c9235de7ebc8c6a8346ddad9f166434551fa048d05fd6fefd"
    },
    "packages": {
      "root": {
        "id": "org.seedspec.fixtures.portable-feature",
        "version": "0.1.0",
        "digest": "sha256:9adb6b0695ad5341842e9ec661288f8e216db50c8bb094e9897900e39dd5093c"
      },
      "additions": []
    },
    "inputs": {
      "configuration_selections": "sha256:e96561d7013f1624659d6803704dc0ef52a89a711d7a1299ec19bed0c2b47736",
      "applied_intent": "sha256:f12895dacb0e1523c79142db45c188fade2c0342d7b328665927c9a2094fc0d7"
    },
    "result": {
      "status": "ready",
      "output_digest": "sha256:faf98a2b7dc0dc3208148a8a8562e3d07b1c061a6ae0eec924274837dcf8ec78"
    }
  },
  "producer": {
    "name": "@seedspec/runtime",
    "version": "0.2.1"
  }
}
